{
  "version": 1,
  "project": {
    "name": "My Project",
    "model": "meta-and-children",
    "meta_repo": "my-org-main",
    "repos": ["my-org-main", "my-org-api", "my-org-web"]
  },
  "scm": {
    "provider": "github",
    "owner": "my-org",
    "default_branch": "main",
    "allow_force": false
  },
  "branch": {
    "feature": "{initials}/{issue}-{slug}",
    "integration": "deployments/wave-{wave}"
  },
  "labels": {
    "wave": "wave-{id}",
    "tech_debt": "tech-debt"
  },
  "board": {
    "enabled": true,
    "project_number": 1,
    "wave_field": "Wave"
  },
  "identity": {
    "enforce": true,
    "email_pattern": "team+{First}.{Last}@example.com",
    "roster_source": ".claude/team/roster.json",
    "allow_emails": ["owner@example.com"]
  },
  "policy": {
    "reviewers_required": 2,
    "merge_model": "wave-branch",
    "admin_merge_exceptions": {
      "wave-merge": "the wave->main wrapup merge (orchestrator-merged)",
      "emergency": "[EMERGENCY]-prefixed restore work"
    },
    "load_bearing_test_exceptions": {},
    "tech_debt_intake_pct": 20,
    "tech_debt_exit_ratio_pct": 10,
    "retro_counter_drift_abs": 2,
    "retro_counter_drift_pct": 5
  },
  "ci": {
    "merge_requires_green": true,
    "empty_rollup_is_blocking": true,
    "neutral_pending_check_prefixes": ["chromatic"],
    "tooling": ["ruff", "mypy", "pytest"]
  },
  "shell": "zsh",
  "paths": {
    "team": ".claude/team",
    "memory": ".claude/memory",
    "ontology": "ontology",
    "state_file": ".claude/state.json",
    "events_log": ".claude/framework/events.jsonl",
    "generic_prompt_ledger": ".claude/generic_prompt_ledger.json",
    "promotion_audit_log": ".claude/team/promotion_audit_log"
  },
  "hooks": {
    "pre_bash": [
      "block_no_verify",
      "block_git_config",
      "no_worktree_self_delete",
      "warn_zsh_wordsplit",
      "validate_labels",
      "validate_review_comment_format",
      "validate_workflow_paths_coverage",
      "require_load_bearing_test",
      "validate_pr_ci_status",
      "block_squash_wave_merge"
    ],
    "post_bash": ["warn_pipe_mask_rc"],
    "post_file": ["ontology_tracker", "suggest_generic_prompt"],
    "session_start": ["ontology_refresh", "session_start"],
    "agent": [],
    "stop": ["session_handoff"],
    "pre_push_commands": ["ruff check .", "pytest -q"]
  }
}
